sarif-2.2/prose/edit/etc/section-display-to-text.json

{
  "1": "Scope",
  "2": "Definitions and Acronyms",
  "2.1": "Definitions",
  "2.1.1": "Terms Defined Elsewhere",
  "2.1.2": "Terms Defined in this Document",
  "2.2": "Abbreviations and Acronyms",
  "3": "Document Conventions",
  "3.1": "Key Words",
  "3.2": "Typographical Conventions",
  "3.2.1": "Format Examples",
  "3.2.2": "Property Notation",
  "3.2.3": "Syntax Notation",
  "3.2.4": "Commonly Used Objects",
  "4": "Introduction",
  "4.1": "Trademarks",
  "4.2": "Changes From the Previous Version (2.1)",
  "4.2.1": "File Format Extensions",
  "4.2.2": "Other changes",
  "5": "File Format",
  "5.1": "General",
  "5.2": "SARIF File Naming Convention",
  "5.3": "`artifactContent` Object",
  "5.3.1": "General",
  "5.3.2": "`text` Property",
  "5.3.3": "`binary` Property",
  "5.3.4": "`rendered` Property",
  "5.4": "`artifactLocation` Object",
  "5.4.1": "General",
  "5.4.2": "Constraints",
  "5.4.3": "`uri` Property",
  "5.4.4": "`uriBaseId` Property",
  "5.4.5": "`index` Property",
  "5.4.6": "`description` Property",
  "5.4.7": "Guidance on the Use of `artifactLocation` Objects",
  "5.5": "String Properties",
  "5.5.1": "Localizable Strings",
  "5.5.2": "Redactable Strings",
  "5.5.3": "GUID-valued Strings",
  "5.5.4": "Hierarchical Strings",
  "5.5.4.1": "General",
  "5.5.4.2": "Versioned Hierarchical Strings",
  "5.6": "Object Properties",
  "5.7": "Array Properties",
  "5.7.1": "General",
  "5.7.2": "Default Value",
  "5.7.3": "Array Properties with Unique Values",
  "5.7.4": "Array Indices",
  "5.8": "Property Bags",
  "5.8.1": "General",
  "5.8.2": "Tags",
  "5.8.2.1": "General",
  "5.8.2.2": "Tag Metadata",
  "5.9": "Date/time Properties",
  "5.10": "URI-valued Properties",
  "5.10.1": "General",
  "5.10.2": "Normalizing File Scheme URIs",
  "5.10.3": "URIs That use the SARIF Scheme",
  "5.10.4": "Internationalized Resource Identifiers (IRIs)",
  "5.11": "`message` Object",
  "5.11.1": "General",
  "5.11.2": "Constraints",
  "5.11.3": "Plain Text Messages",
  "5.11.4": "Formatted Messages",
  "5.11.4.1": "General",
  "5.11.4.2": "Security Implications",
  "5.11.5": "Messages with Placeholders",
  "5.11.6": "Messages with Embedded Links",
  "5.11.7": "Message String Lookup",
  "5.11.8": "`text` Property",
  "5.11.9": "`markdown` Property",
  "5.11.10": "`id` Property",
  "5.11.11": "`arguments` Property",
  "5.12": "`multiformatMessageString` Object",
  "5.12.1": "General",
  "5.12.2": "Localizable `multiformatMessageStrings`",
  "5.12.3": "`text` Property",
  "5.12.4": "`markdown` Property",
  "5.13": "`sarifLog` Object",
  "5.13.1": "General",
  "5.13.2": "`version` Property",
  "5.13.3": "`$schema` Property",
  "5.13.4": "`runs` Property",
  "5.13.5": "`inlineExternalProperties` Property",
  "5.13.6": "`guid` Property",
  "5.14": "`run` Object",
  "5.14.1": "General",
  "5.14.2": "`externalPropertyFileReferences` Property",
  "5.14.3": "`automationDetails` Property",
  "5.14.4": "`runAggregates` Property",
  "5.14.5": "`baselineGuid` Property",
  "5.14.6": "`tool` Property",
  "5.14.7": "`language` Property",
  "5.14.8": "`taxonomies` Property",
  "5.14.9": "`translations` Property",
  "5.14.10": "`policies` Property",
  "5.14.11": "`invocations` Property",
  "5.14.12": "`conversion` Property",
  "5.14.13": "`versionControlProvenance` Property",
  "5.14.14": "`originalUriBaseIds` Property",
  "5.14.15": "`artifacts` Property",
  "5.14.16": "`specialLocations` Property",
  "5.14.17": "`logicalLocations` Property",
  "5.14.18": "`addresses` Property",
  "5.14.19": "`threadFlowLocations` Property",
  "5.14.20": "`graphs` Property",
  "5.14.21": "`webRequests` Property",
  "5.14.22": "`webResponses` Property",
  "5.14.23": "`results` Property",
  "5.14.24": "`defaultEncoding` Property",
  "5.14.25": "`defaultSourceLanguage` Property",
  "5.14.26": "`newlineSequences` Property",
  "5.14.27": "`columnKind` Property",
  "5.14.28": "`redactionTokens` Property",
  "5.15": "`externalPropertyFileReferences` Object",
  "5.15.1": "General",
  "5.15.2": "Rationale",
  "5.15.3": "Properties",
  "5.16": "`externalPropertyFileReference` Object",
  "5.16.1": "General",
  "5.16.2": "Constraints",
  "5.16.3": "`location` Property",
  "5.16.4": "`guid` Property",
  "5.16.5": "`itemCount` Property",
  "5.17": "`runAutomationDetails` Object",
  "5.17.1": "General",
  "5.17.2": "`description` Property",
  "5.17.3": "`id` Property",
  "5.17.4": "`guid` Property",
  "5.17.5": "`correlationGuid` Property",
  "5.18": "`tool` Object",
  "5.18.1": "General",
  "5.18.2": "`driver` Property",
  "5.18.3": "`extensions` Property",
  "5.19": "`toolComponent` Object",
  "5.19.1": "General",
  "5.19.2": "Constraints",
  "5.19.3": "Taxonomies",
  "5.19.4": "Translations",
  "5.19.5": "Policies",
  "5.19.6": "`guid` Property",
  "5.19.7": "Product hierarchy properties",
  "5.19.8": "`name` Property",
  "5.19.9": "`fullName` Property",
  "5.19.10": "`product` Property",
  "5.19.11": "`productSuite` Property",
  "5.19.12": "`semanticVersion` Property",
  "5.19.13": "`version` Property",
  "5.19.14": "`dottedQuadFileVersion` Property",
  "5.19.15": "`releaseDateUtc` Property",
  "5.19.16": "`downloadUri` Property",
  "5.19.17": "`informationUri` Property",
  "5.19.18": "`organization` Property",
  "5.19.19": "`shortDescription` Property",
  "5.19.20": "`fullDescription` Property",
  "5.19.21": "`language` Property",
  "5.19.22": "`globalMessageStrings` Property",
  "5.19.23": "`rules` Property",
  "5.19.24": "`notifications` Property",
  "5.19.25": "`taxa` Property",
  "5.19.26": "`supportedTaxonomies` Property",
  "5.19.27": "`translationMetadata` Property",
  "5.19.28": "`locations` Property",
  "5.19.29": "`contents` Property",
  "5.19.30": "`isComprehensive` Property",
  "5.19.31": "`localizedDataSemanticVersion` Property",
  "5.19.32": "`minimumRequiredLocalizedDataSemanticVersion` Property",
  "5.19.33": "`associatedComponent` Property",
  "5.20": "`invocation` Object",
  "5.20.1": "General",
  "5.20.2": "`commandLine` Property",
  "5.20.3": "arguments property",
  "5.20.4": "`responseFiles` Property",
  "5.20.5": "`ruleConfigurationOverrides` Property",
  "5.20.6": "`notificationConfigurationOverrides` Property",
  "5.20.7": "`startTimeUtc` Property",
  "5.20.8": "`endTimeUtc` Property",
  "5.20.9": "`exitCode` Property",
  "5.20.10": "`exitCodeDescription` Property",
  "5.20.11": "`exitSignalName` Property",
  "5.20.12": "`exitSignalNumber` Property",
  "5.20.13": "`processStartFailureMessage` Property",
  "5.20.14": "`executionSuccessful` Property",
  "5.20.15": "`machine` Property",
  "5.20.16": "`account` Property",
  "5.20.17": "`processId` Property",
  "5.20.18": "`executableLocation` Property",
  "5.20.19": "`workingDirectory` Property",
  "5.20.20": "`environmentVariables` Property",
  "5.20.21": "`toolExecutionNotifications` Property",
  "5.20.22": "`toolConfigurationNotifications` Property",
  "5.20.23": "`stdin`, `stdout`, `stderr`, and `stdoutStderr` Properties",
  "5.21": "`attachment` Object",
  "5.21.1": "General",
  "5.21.2": "`description` Property",
  "5.21.3": "`location` Property",
  "5.21.4": "`regions` Property",
  "5.21.5": "`rectangles` Property",
  "5.22": "`conversion` Object",
  "5.22.1": "General",
  "5.22.2": "`tool` Property",
  "5.22.3": "`invocation` Property",
  "5.22.4": "`analysisToolLogFiles` Property",
  "5.23": "`versionControlDetails` Object",
  "5.23.1": "General",
  "5.23.2": "Constraints",
  "5.23.3": "`repositoryUri` Property",
  "5.23.4": "revisionId` Property",
  "5.23.5": "`branch` Property",
  "5.23.6": "`revisionTag` Property",
  "5.23.7": "`asOfTimeUtc` Property",
  "5.23.8": "`mappedTo` Property",
  "5.24": "`artifact` Object",
  "5.24.1": "General",
  "5.24.2": "`location property",
  "5.24.3": "`parentIndex` Property",
  "5.24.4": "`offset` Property",
  "5.24.5": "`length` Property",
  "5.24.6": "`roles` Property",
  "5.24.7": "`mimeType` Property",
  "5.24.8": "`contents` Property",
  "5.24.9": "`encoding` Property",
  "5.24.10": "`sourceLanguage` Property",
  "5.24.10.1": "General",
  "5.24.10.2": "Source language identifier conventions and practices",
  "5.24.11": "`hashes` Property",
  "5.24.12": "`lastModifiedTimeUtc` Property",
  "5.24.13": "`description` Property",
  "5.25": "`specialLocations` Object",
  "5.25.1": "General",
  "5.25.2": "`displayBase` Property",
  "5.26": "`translationMetadata` Object",
  "5.26.1": "General",
  "5.26.2": "`name` Property",
  "5.26.3": "`fullName` Property",
  "5.26.4": "`shortDescription` Property",
  "5.26.5": "`fullDescription` Property",
  "5.26.6": "`downloadUri` Property",
  "5.26.7": "`informationUri` Property",
  "5.27": "`result` Object",
  "5.27.1": "General",
  "5.27.2": "Distinguishing logically identical from logically distinct results",
  "5.27.3": "guid property",
  "5.27.4": "`correlationGuid` Property",
  "5.27.5": "`ruleId` Property",
  "5.27.6": "`ruleIndex` Property",
  "5.27.7": "`rule` Property",
  "5.27.8": "`taxa` Property",
  "5.27.9": "`kind` Property",
  "5.27.10": "`level` Property",
  "5.27.11": "`message` Property",
  "5.27.12": "`locations` Property",
  "5.27.13": "`analysisTarget` Property",
  "5.27.14": "`webRequest` Property",
  "5.27.15": "`webResponse` Property",
  "5.27.16": "`fingerprints` Property",
  "5.27.17": "`partialFingerprints` Property",
  "5.27.18": "`codeFlows` Property",
  "5.27.19": "`graphs` Property",
  "5.27.20": "`graphTraversals` Property",
  "5.27.21": "`stacks` Property",
  "5.27.22": "`relatedLocations` Property",
  "5.27.23": "`suppressions` Property",
  "5.27.24": "`baselineState` Property",
  "5.27.25": "`rank` Property",
  "5.27.26": "`precision` Property",
  "5.27.27": "`securitySeverity` Property",
  "5.27.28": "`attachments` Property",
  "5.27.29": "`workItemUris` Property",
  "5.27.30": "`hostedViewerUri` Property",
  "5.27.31": "`provenance` Property",
  "5.27.32": "`fixes` Property",
  "5.27.33": "`occurrenceCount` Property",
  "5.28": "`location` Object",
  "5.28.1": "General",
  "5.28.2": "`id` Property",
  "5.28.3": "`physicalLocation` Property",
  "5.28.4": "`logicalLocations` Property",
  "5.28.5": "`message` Property",
  "5.28.6": "`annotations` Property",
  "5.28.7": "`relationships` Property",
  "5.29": "`physicalLocation` Object",
  "5.29.1": "General",
  "5.29.2": "Constraints",
  "5.29.3": "`artifactLocation` Property",
  "5.29.4": "`region` Property",
  "5.29.5": "`contextRegion` Property",
  "5.29.6": "`address` Property",
  "5.30": "`region` Object",
  "5.30.1": "General",
  "5.30.2": "Text Regions",
  "5.30.3": "Binary Regions",
  "5.30.4": "Independence of Text and Binary Regions",
  "5.30.5": "`startLine` Property",
  "5.30.6": "`startColumn` Property",
  "5.30.7": "`endLine` Property",
  "5.30.8": "`endColumn` Property",
  "5.30.9": "`charOffset` Property",
  "5.30.10": "`charLength` Property",
  "5.30.11": "`byteOffset` Property",
  "5.30.12": "`byteLength` Property",
  "5.30.13": "`snippet` Property",
  "5.30.14": "`message` Property",
  "5.30.15": "`sourceLanguage` Property",
  "5.31": "`rectangle` Object",
  "5.31.1": "General",
  "5.31.2": "`top`, `left`, `bottom`, and `right` Properties",
  "5.31.3": "`message` Property",
  "5.32": "`address` Object",
  "5.32.1": "General",
  "5.32.2": "Parent-child Relationships",
  "5.32.3": "Absolute Address Calculation",
  "5.32.4": "Relative Address Calculation",
  "5.32.5": "`index` Property",
  "5.32.6": "`absoluteAddress` Property",
  "5.32.7": "`relativeAddress` Property",
  "5.32.8": "`offsetFromParent` Property",
  "5.32.9": "`length` Property",
  "5.32.10": "`name` Property",
  "5.32.11": "`fullyQualifiedName` Property",
  "5.32.12": "`kind` Property",
  "5.32.13": "`parentIndex` Property",
  "5.33": "`logicalLocation` Object",
  "5.33.1": "General",
  "5.33.2": "Logical Location Naming Rules",
  "5.33.3": "`index` Property",
  "5.33.4": "`name` Property",
  "5.33.5": "`fullyQualifiedName` Property",
  "5.33.6": "`decoratedName` Property",
  "5.33.7": "`kind` Property",
  "5.33.8": "`parentIndex` Property",
  "5.34": "`locationRelationship` Object",
  "5.34.1": "General",
  "5.34.2": "`target` Property",
  "5.34.3": "`kinds` Property",
  "5.34.4": "`description` Property",
  "5.35": "`suppression` Object",
  "5.35.1": "General",
  "5.35.2": "`kind` Property",
  "5.35.3": "`status` Property",
  "5.35.4": "`location` Property",
  "5.35.5": "`guid` Property",
  "5.35.6": "`justification` Property",
  "5.35.7": "`justificationType` Property",
  "5.36": "`codeFlow` Object",
  "5.36.1": "General",
  "5.36.2": "`message` Property",
  "5.36.3": "`threadFlows` Property",
  "5.37": "`threadFlow` Object",
  "5.37.1": "General",
  "5.37.2": "`id` Property",
  "5.37.3": "`message` Property",
  "5.37.4": "`initialState` Property",
  "5.37.5": "`immutableState` Property",
  "5.37.6": "`locations` Property",
  "5.38": "`threadFlowLocation` Object",
  "5.38.1": "General",
  "5.38.2": "`index` Property",
  "5.38.3": "`location` Propertyy",
  "5.38.4": "`module` Property",
  "5.38.5": "`stack` Property",
  "5.38.6": "`webRequest` Property",
  "5.38.7": "`webResponse` Property",
  "5.38.8": "`kinds` Property",
  "5.38.9": "`state` Property",
  "5.38.10": "`nestingLevel` Property",
  "5.38.11": "`executionOrder` Property",
  "5.38.12": "`executionTimeUtc` Property",
  "5.38.13": "`importance` Property",
  "5.38.14": "`taxa` Property",
  "5.39": "`graph` Object",
  "5.39.1": "General",
  "5.39.2": "`description` Property",
  "5.39.3": "`nodes` Property",
  "5.39.4": "`edges` Property",
  "5.40": "`node` Object",
  "5.40.1": "General",
  "5.40.2": "`id` Property",
  "5.40.3": "`label` Property",
  "5.40.4": "`location` Property",
  "5.40.5": "`children` Property",
  "5.41": "`edge` Object",
  "5.41.1": "General",
  "5.41.2": "`id` Property",
  "5.41.3": "`label` Property",
  "5.41.4": "`sourceNodeId` Property",
  "5.41.5": "`targetNodeId` Property",
  "5.42": "`graphTraversal` Object",
  "5.42.1": "General",
  "5.42.2": "Constraints",
  "5.42.3": "`resultGraphIndex` Property",
  "5.42.4": "`runGraphIndex` Property",
  "5.42.5": "`description` Property",
  "5.42.6": "`initialState` Property",
  "5.42.7": "`immutableState` Property",
  "5.42.8": "`edgeTraversals` Property",
  "5.43": "`edgeTraversal` Object",
  "5.43.1": "General",
  "5.43.2": "`edgeId` Property",
  "5.43.3": "`message` Property",
  "5.43.4": "`finalState` Property",
  "5.43.5": "`stepOverEdgeCount` Property",
  "5.44": "`stack` Object",
  "5.44.1": "General",
  "5.44.2": "`message` Property",
  "5.44.3": "`frames` Property",
  "5.45": "`stackFrame` Object",
  "5.45.1": "General",
  "5.45.2": "`location` Property",
  "5.45.3": "`module` Property",
  "5.45.4": "`threadId` Property",
  "5.45.5": "`parameters` Property",
  "5.46": "`webRequest` Object",
  "5.46.1": "General",
  "5.46.2": "`index` Property",
  "5.46.3": "`protocol` Property",
  "5.46.4": "`version` Property",
  "5.46.5": "`target` Property",
  "5.46.6": "`method` Property",
  "5.46.7": "`headers` Property",
  "5.46.8": "`parameters` Property",
  "5.46.9": "`body` Property",
  "5.47": "`webResponse` Object",
  "5.47.1": "General",
  "5.47.2": "`index` Property",
  "5.47.3": "`protocol` Property",
  "5.47.4": "`version` Property",
  "5.47.5": "`statusCode` Property",
  "5.47.6": "`reasonPhrase` Property",
  "5.47.7": "`headers` Property",
  "5.47.8": "`body` Property",
  "5.47.9": "`noResponseReceived` Property",
  "5.48": "`resultProvenance` Object",
  "5.48.1": "General",
  "5.48.2": "`firstDetectionTimeUtc` Property",
  "5.48.3": "`lastDetectionTimeUtc` Property",
  "5.48.4": "`firstDetectionRunGuid` Property",
  "5.48.5": "`lastDetectionRunGuid` Property",
  "5.48.6": "`invocationIndex` Property",
  "5.48.7": "`conversionSources` Property",
  "5.49": "`reportingDescriptor` Object",
  "5.49.1": "General",
  "5.49.2": "Constraints",
  "5.49.3": "`id` Property",
  "5.49.4": "`deprecatedIds` Property",
  "5.49.5": "`guid` Property",
  "5.49.6": "`deprecatedGuids` Property",
  "5.49.7": "`name` Property",
  "5.49.8": "`deprecatedNames` Property",
  "5.49.9": "`shortDescription` Property",
  "5.49.10": "`fullDescription` Property",
  "5.49.11": "`messageStrings` Property",
  "5.49.12": "`helpUri` Property",
  "5.49.13": "`help` Property",
  "5.49.14": "`defaultConfiguration` Property",
  "5.49.15": "`precision` Property",
  "5.49.16": "`securitySeverity` Property",
  "5.49.17": "`relationships` Property",
  "5.50": "`reportingConfiguration` Object",
  "5.50.1": "General",
  "5.50.2": "`enabled` Property",
  "5.50.3": "`level` Property",
  "5.50.4": "`rank` Property",
  "5.50.5": "`parameters` Property",
  "5.51": "`configurationOverride` Object",
  "5.51.1": "General",
  "5.51.2": "`descriptor` Property",
  "5.51.3": "`configuration` Property",
  "5.52": "`reportingDescriptorReference` Object",
  "5.52.1": "General",
  "5.52.2": "Constraints",
  "5.52.3": "Reportingdescriptor Lookup",
  "5.52.4": "`id` Property",
  "5.52.5": "`index` Property",
  "5.52.6": "`guid` Property",
  "5.52.7": "`toolComponent` Property",
  "5.53": "`reportingDescriptorRelationship` Object",
  "5.53.1": "General",
  "5.53.2": "`target` Property",
  "5.53.3": "`kinds` Property",
  "5.53.4": "`description` Property",
  "5.54": "`toolComponentReference` Object",
  "5.54.1": "General",
  "5.54.2": "Toolcomponent Lookup",
  "5.54.3": "`name` Property",
  "5.54.4": "`index` Property",
  "5.54.5": "`guid` Property",
  "5.55": "`fix` Object",
  "5.55.1": "General",
  "5.55.2": "`description` Property",
  "5.55.3": "`artifactChanges` Property",
  "5.56": "`artifactChange` Object",
  "5.56.1": "General",
  "5.56.2": "`artifactLocation` Property",
  "5.56.3": "`replacements` Property",
  "5.57": "`replacement` Object",
  "5.57.1": "General",
  "5.57.2": "Constraints",
  "5.57.3": "`deletedRegion` Property",
  "5.57.4": "`insertedContent` Property",
  "5.58": "`notification` Object",
  "5.58.1": "General",
  "5.58.2": "`descriptor` Property",
  "5.58.3": "`associatedRule` Property",
  "5.58.4": "`locations` Property",
  "5.58.5": "`message` Property",
  "5.58.6": "`level` Property",
  "5.58.7": "`threadId` Property",
  "5.58.8": "`timeUtc` Property",
  "5.58.9": "`exception` Property",
  "5.58.10": "`relatedLocations` Property",
  "5.59": "`exception` Object",
  "5.59.1": "General",
  "5.59.2": "`kind` Property",
  "5.59.3": "`message` Property",
  "5.59.4": "`stack` Property",
  "5.59.5": "`innerExceptions` Property",
  "6": "External property file format",
  "6.1": "General",
  "6.2": "External Property File Naming Convention",
  "6.3": "`externalProperties` Object",
  "6.3.1": "General",
  "6.3.2": "`$schema` Property",
  "6.3.3": "`version` Property",
  "6.3.4": "`guid` Property",
  "6.3.5": "`runGuid` Property",
  "6.3.6": "The Property Value Properties",
  "7": "Safety, Security and Data Protection",
  "8": "Conformance",
  "8.1": "Conformance Targets",
  "8.2": "Conformance Clause 1: SARIF Log File",
  "8.3": "Conformance Clause 2: SARIF Producer",
  "8.4": "Conformance Clause 3: Direct Producer",
  "8.5": "Conformance Clause 4: Converter",
  "8.6": "Conformance Clause 5: SARIF Post-Processor",
  "8.7": "Conformance Clause 6: SARIF Consumer",
  "8.8": "Conformance Clause 7: Viewer",
  "8.9": "Conformance Clause 8: Result Management System",
  "8.10": "Conformance Clause 9: Engineering System",
  "Annex A": "License, Document Status and Notices",
  "A.1": "Document Status",
  "A.2": "License and Notices",
  "Annex B": "References",
  "B.1": "Normative References",
  "B.2": "Informative References",
  "Annex C": "Use of Fingerprints by Result Management Systems",
  "Annex D": "Production of SARIF by Converters",
  "Appendix 1": "Acknowledgments",
  "Appendix 2": "Revision History",
  "Appendix 3": "Use of SARIF by Log File Viewers",
  "Appendix 4": "Locating Rule and Notification Metadata",
  "Appendix 5": "Producing Deterministic SARIF Log Files",
  "General": "General",
  "Non-Deterministic File Format Elements": "Non-Deterministic File Format Elements",
  "Array and Dictionary Element Ordering": "Array and Dictionary Element Ordering",
  "Absolute Paths": "Absolute Paths",
  "Inherently Non-Deterministic Tools": "Inherently Non-Deterministic Tools",
  "Compensating for Non-Deterministic Output": "Compensating for Non-Deterministic Output",
  "Interaction Between Determinism and Baselining": "Interaction Between Determinism and Baselining",
  "Appendix 6": "Guidance on Fixes",
  "Appendix 7": "Diagnosing Results in Generated Files",
  "Appendix 8": "Detecting Incomplete Result Sets",
  "Appendix 9": "Sample `sourceLanguage` Values",
  "Appendix 10": "Examples",
  "Minimal Valid SARIF Log File": "Minimal Valid SARIF Log File",
  "Minimal Recommended SARIF Log File with Source Information": "Minimal Recommended SARIF Log File with Source Information",
  "Minimal Recommended SARIF Log File without Source Information": "Minimal Recommended SARIF Log File without Source Information",
  "Comprehensive SARIF File": "Comprehensive SARIF File",
  "Appendix 11": "MIME Types and File Name Extensions"
}

sarif-2.2/prose/edit/src/introduction.md

### File Format Extensions

* 3.9 (now 5.9): added examples of expiry dates (#492) (#644)
* 3.12 (now 5.12) `multiformatMessage` object: `"text"` property can now contain embedded links (#471) (#636)
* 3.13 (now 5.13) `sarifLog` object: added `"guid"` property (#483) (#641)
* 3.14 (now 5.14) `run` object: added `"bytes"` as a value for the `columnKind` property (#466) (#740)
* 3.23 (now 5.23) `artefact` object: added `"scannedFile"` as a value for the `role` property (#459) (#642)
* 3.35 (now 5.35) `suppression` object: added `"justificationType"` property (#574) (#672)

* 3.38 (now 5.38) `threadflowlocation` object: added new values to `"kinds`":
  * `"catch"` for catching an exception (#735) (#756)
  * `"expose"`: for exposure of a secret across a trust boundary (e.g. password written to a logfile or an uninitialized stack copied from kernel back to user space) (#530) (#671)
  * `"longjmp"` for calls to `longjmp` that rewind the program counter/stack to the location of a previous `setjmp` call (#735) (#756)
  * `"sensitive"`: for a value that is known to be secret e.g. a password or a private key (#530) (#671)
  * `"setjmp"` for calls to `setjmp` (#735) (#756)
  * `"throw"` for throwing an exception (#735) (#756)</mark>
  * `"uninitialized"`: for uninitialized memory (#530) (#671)
  * `"unwind"` for unwinding stack frame(s) during exception-handling (#735) (#756)

* 3.58 (now 5.58) `notification` object: added `"relatedLocations"` property (#491) (#643)